{
  "schema": "calibration/v1",
  "listing_id": "87977241",
  "images": [
    {
      "image_id": "i000",
      "fov_x_deg": 98.6,
      "fov_y_deg": 75.66,
      "intrinsics": null,
      "engine": "phase0_fov_prior",
      "agreement": null,
      "quality_flags": []
    },
    {
      "image_id": "i002",
      "fov_x_deg": 98.6,
      "fov_y_deg": 75.66,
      "intrinsics": null,
      "engine": "phase0_fov_prior",
      "agreement": null,
      "quality_flags": []
    },
    {
      "image_id": "i003",
      "fov_x_deg": 98.6,
      "fov_y_deg": 76.63,
      "intrinsics": null,
      "engine": "phase0_fov_prior",
      "agreement": null,
      "quality_flags": []
    },
    {
      "image_id": "i004",
      "fov_x_deg": 98.6,
      "fov_y_deg": 76.55,
      "intrinsics": null,
      "engine": "phase0_fov_prior",
      "agreement": null,
      "quality_flags": []
    },
    {
      "image_id": "i005",
      "fov_x_deg": 98.6,
      "fov_y_deg": 76.47,
      "intrinsics": null,
      "engine": "phase0_fov_prior",
      "agreement": null,
      "quality_flags": []
    },
    {
      "image_id": "i006",
      "fov_x_deg": 98.6,
      "fov_y_deg": 75.66,
      "intrinsics": null,
      "engine": "phase0_fov_prior",
      "agreement": null,
      "quality_flags": []
    },
    {
      "image_id": "i007",
      "fov_x_deg": 98.6,
      "fov_y_deg": 75.66,
      "intrinsics": null,
      "engine": "phase0_fov_prior",
      "agreement": null,
      "quality_flags": []
    }
  ],
  "confidence": 0.4,
  "qa_flags": [],
  "timing_s": 0.0
}
